{
  "$schema": "http://json-schema.org/draft-04/schema#",
  "type": "object",
  "description": "FMS contragent events",
  "definitions": {
    "uuid": {
      "type": "string",
      "pattern": "^[0-9a-fA-F]{8}-[0-9a-fA-F]{4}-[0-9a-fA-F]{4}-[0-9a-fA-F]{4}-[0-9a-fA-F]{12}$"
    }
  },
  "required": [
    "sender",
    "timestamp",
    "contragent_id",
    "contragent_reg_id",
    "action",
    "reason"
  ],
  "properties": {
    "sender": {
      "type": "string",
      "description": "Sender name",
      "enum": [
        "tbt"
      ]
    },
    "timestamp": {
      "description": "Send time",
      "type": "string",
      "format": "date-time"
    },
    "contragent_id": {
      "$ref": "#/definitions/uuid",
      "description": "Contragent identifier"
    },
    "contragent_reg_id": {
      "type": "string",
      "description": "Contragent external/state identifier"
    },
    "action": {
      "type": "string",
      "description": "action",
      "enum": [
        "created",
        "deleted",
        "updated",
        "blocked",
        "disabled"
      ]
    },
    "reason": {
      "type": "string",
      "description": "reason",
      "enum": [
        "self",
        "requisites",
        "fraud",
        "disaster",
        "other"
      ]
    },
    "merchant_id": {
      "anyOf": [
        {
          "type": "string",
          "description": "Payment system contragent identifier"
        },
        {
          "type": "null"
        }
      ]
    },
    "comment": {
      "type": "string",
      "description": "Additional info"
    },
    "msg_for": {
      "$ref": "#/definitions/uuid",
      "description": "User id to proxy message for"
    },
    "group": {
      "$ref": "#/definitions/uuid",
      "description": "Agent group"
    }
  }
}
